{
  "$schema": "../../schema/monster.json",
  "name": "Werewolf",
  "description": "A bipedal, wolf-faced humanoid covered in brown fur.",
  "ac": 12,
  "hp": 20,
  "attacks": [
    { "name": "rend", "count": 2, "bonus": 3, "damage": "1d6" }
  ],
  "movement": "Double Near",
  "stats": { "str": 3, "dex": 2, "con": 2, "int": 0, "wis": 1, "cha": 0 },
  "alignment": "C",
  "level": 4,
  "special_abilities": [
    { "name": "Impervious", "description": "Only damaged by silver or magic sources." },
    { "name": "Lycanthropy", "description": "If a character takes 12 or more damage from the same werewolf, they contract lycanthropy." }
  ],
  "source": "data/source/quickstart-set.json"
}
