{
  "$schema": "../../schema/monster.json",
  "name": "Spider, Giant",
  "description": "Bulbous abdomen and eight, spindly legs. Ambush hunter.",
  "ac": 13,
  "hp": 13,
  "attacks": [
    { "name": "bite", "count": 1, "bonus": 3, "damage": "1d4", "special": "poison" }
  ],
  "movement": "Near (climb)",
  "stats": { "str": 2, "dex": 3, "con": 0, "int": -2, "wis": 1, "cha": -2 },
  "alignment": "N",
  "level": 3,
  "special_abilities": [
    { "name": "Poison", "description": "DC 12 CON or paralyzed 1d4 hours." }
  ],
  "source": "data/source/quickstart-set.json"
}
