{
  "$schema": "../../schema/monster.json",
  "name": "Cultist",
  "description": "A cloaked, wild-eyed zealot chanting the guttural prayers of a dark god.",
  "ac": 14,
  "hp": 9,
  "attacks": [
    { "name": "longsword", "count": 1, "bonus": 1, "damage": "1d8" },
    { "name": "spell", "count": 1, "bonus": 2, "damage": "2d4" }
  ],
  "movement": "Near",
  "stats": { "str": 1, "dex": -1, "con": 0, "int": -1, "wis": 2, "cha": 0 },
  "alignment": "C",
  "level": 2,
  "special_abilities": [
    { "name": "Fearless", "description": "Immune to morale checks." },
    { "name": "Deathtouch (WIS Spell)", "description": "DC 12. 2d4 damage to one creature within close." }
  ],
  "source": "data/source/quickstart-set.json"
}
