{
  "$schema": "../../schema/monster.json",
  "name": "Dung Beetle, Giant",
  "description": "A trundling, barrel-sized beetle with a T-shaped horn.",
  "ac": 13,
  "hp": 10,
  "attacks": [
    { "name": "horn", "count": 1, "bonus": 1, "damage": "1d4", "special": "knock" }
  ],
  "movement": "Near",
  "stats": { "str": 1, "dex": -1, "con": 1, "int": -3, "wis": -1, "cha": -3 },
  "alignment": "N",
  "level": 2,
  "special_abilities": [
    { "name": "Knock", "description": "DC 9 STR or pushed a close distance and fall down." }
  ],
  "source": "data/source/quickstart-set.json"
}
