{
  "$schema": "../../schema/monster.json",
  "name": "Hobgoblin",
  "description": "A sturdy, tall goblin with russet skin. Militant and strategic.",
  "ac": 15,
  "hp": 10,
  "attacks": [
    { "name": "longsword", "count": 1, "bonus": 3, "damage": "1d8" },
    { "name": "longbow", "count": 1, "range": "Far", "bonus": 0, "damage": "1d8" }
  ],
  "movement": "Near",
  "stats": { "str": 3, "dex": 0, "con": 1, "int": 2, "wis": 1, "cha": 1 },
  "alignment": "C",
  "level": 2,
  "special_abilities": [
    { "name": "Phalanx", "description": "+1 to attacks and AC when in close range of an allied hobgoblin." }
  ],
  "source": "data/source/quickstart-set.json"
}
